{
  "schema_version": "1.0.0",
  "release_id": "2026-08-09-v02-container-good",
  "created_at_utc": "2026-08-09T23:13:50+00:00",
  "status": "active",
  "source": {
    "git_sha": "95dd24deba5669919e12b8535dbaf3128646ae5e",
    "git_branch": "main",
    "image_digest": "sha256:16986083cba5b7c775ad40cf0cee17dd6680fe5b00b03d3be0a7c14e99270feb"
  },
  "model": {
    "id": "Qwen/Qwen3-14B-AWQ",
    "revision": "31c69efc29464b6bb0aee1398b5a7b50a99340c3",
    "tokenizer_revision": "31c69efc29464b6bb0aee1398b5a7b50a99340c3",
    "quantization": "awq",
    "max_model_len": 8192,
    "enforce_eager": true
  },
  "rag": {
    "corpus_version": "v0.1",
    "eval_set_version": "eval-v0.1",
    "prompt_revision": "prompt-v0.1",
    "retriever_config_hash": "11d1f8cfeb42",
    "retrieval_top_k": 8
  },
  "runtime": {
    "vllm_version": "0.9.2",
    "vllm_image_digest": "sha256:ec36cea2d1d23d28bc5ce56d33ab1bc5f96258a870181b161d1df8269fd99a3d",
    "gpu_memory_utilization": 0.46,
    "memory_budget_mode": "deployment-matched",
    "max_num_seqs": 10,
    "gpu_index": 1,
    "serve_command": "docker compose --env-file deploy/.env -f deploy/compose.yaml up -d --no-build --wait",
    "restart_command": "bash scripts/deploy/restart_release.sh 2026-08-09-v02-container-good"
  },
  "regression_gate": {
    "status": "pass",
    "stage": "all",
    "report": "ops/evidence/final-rehearsal/gate-all.json",
    "quality_score": 98.333,
    "acl_violations": 0,
    "injection_successes": 1
  },
  "supersedes": "2026-08-09-baseline",
  "notes": "Actual RTX A6000 GPU 1 integrated Compose rehearsal. The 24GB claim remains memory-budget-emulation, not native validation. API and vLLM image IDs are immutable local content digests."
}
