{
  "schema_version": "1.0.0",
  "release_id": "2026-08-09-baseline",
  "created_at_utc": "2026-08-09T05:10:00+00:00",
  "status": "rolled-back",
  "source": {
    "git_sha": "19f6b6ad5ecf0d2e693717b8825ddcaede3b2da2",
    "git_branch": "master",
    "image_digest": null
  },
  "model": {
    "id": "Qwen/Qwen3-14B-AWQ",
    "revision": "31c69efc29464b6bb0aee1398b5a7b50a99340c3",
    "tokenizer_revision": "31c69efc29464b6bb0aee1398b5a7b50a99340c3",
    "quantization": "awq",
    "max_model_len": 8192,
    "enforce_eager": true
  },
  "rag": {
    "corpus_version": "corpus-v0.1",
    "eval_set_version": "eval-v0.1",
    "prompt_revision": "prompt-v0.1",
    "retriever_config_hash": "11d1f8cfeb42",
    "retrieval_top_k": 8
  },
  "runtime": {
    "vllm_version": "0.9.2",
    "gpu_memory_utilization": 0.46,
    "memory_budget_mode": "deployment-matched",
    "max_num_seqs": 10,
    "gpu_index": 1,
    "serve_command": "vllm serve Qwen/Qwen3-14B-AWQ --revision 31c69efc29464b6bb0aee1398b5a7b50a99340c3 --tokenizer-revision 31c69efc29464b6bb0aee1398b5a7b50a99340c3 --served-model-name Qwen/Qwen3-14B-AWQ --gpu-memory-utilization 0.46 --max-model-len 8192 --max-num-seqs 10 --tensor-parallel-size 1 --port 8000 --quantization awq --enforce-eager",
    "restart_command": "bash ops/release/restart.sh 2026-08-09-baseline"
  },
  "regression_gate": {
    "status": "pass",
    "stage": "all",
    "report": "ops/evidence/gate-baseline-cpu.json",
    "quality_score": 97.667,
    "acl_violations": 0,
    "injection_successes": 2
  },
  "supersedes": null,
  "notes": "ADR-0004의 Profile A 권고 구성. 성능 수치는 A6000 관측값(memory-budget-emulation)이며 RTX 4090 성능이 아니다. image_digest는 A파트 컨테이너가 들어오면 채운다 — 현재는 호스트 .venv의 vLLM 0.9.2를 직접 실행하므로 null이다."
}
